{
  "$schema": "../../../../schemas/plugin.schema.json",
  "name": "cortex-jira",
  "version": "1.0.0",
  "description": "Jira QA scope and business-friendly Jira reports built from tickets and commits",
  "author": {
    "name": "Alexander Danilenko",
    "url": "https://github.com/alexander-danilenko"
  },
  "repository": "https://github.com/alexander-danilenko/cortex-claude-code-plugins",
  "license": "MIT",
  "keywords": ["jira", "qa", "reporting"],
  "dependencies": ["cortex-communication"]
}
