{
  "$schema": "../../../../schemas/plugin.schema.json",
  "name": "cortex-testing",
  "version": "1.0.0",
  "description": "Testing conventions, TDD laws and NestJS Jest references",
  "author": {
    "name": "Alexander Danilenko",
    "url": "https://github.com/alexander-danilenko"
  },
  "repository": "https://github.com/alexander-danilenko/cortex-claude-code-plugins",
  "license": "MIT",
  "keywords": ["testing", "tdd"]
}
