{
  "$schema": "../../../../schemas/plugin.schema.json",
  "name": "cortex-knowledge",
  "version": "1.0.0",
  "description": "Documentation conventions plus a learn-with-docs knowledge base for solved problems",
  "author": {
    "name": "Alexander Danilenko",
    "url": "https://github.com/alexander-danilenko"
  },
  "repository": "https://github.com/alexander-danilenko/cortex-claude-code-plugins",
  "license": "MIT",
  "keywords": ["documentation", "knowledge-base"],
  "dependencies": ["cortex-communication"]
}
